symbol,Program,Grant Number,Partner Organization,Project Title,Award Amount:,Leveraged Funds:,Proposal_Number,Country,Summary,Notes,coordinates
measle_brown,Grate Ape,96200-1-G125,"World Wildlife Fund, Inc.","Securing the long-term sustainability of gorilla tourism as a conservation tool at Dzanga-Sangha, Central African Republic: a World Wildlife Fund-U.S. Fish and Wildlife Service Great Ape Conservation Fund partnership","$159,457.00","$198,263.00",GA-0776,Central African Republic,This project will secure the long-term protection of Dzanga-Sangha National Park through surveillance of illegal activity and a gorilla tourism program.,,"2.987, 16.223"
measle_brown,Grate Ape,96200-1-G199,"World Wildlife Fund, Inc.","Improving protection of great apes in the Dzanga-Sangha Protected Areas, Central African Republic","$106,043.00","$171,100.00",GA-0839 Africa,Central African Republic,This project will secure the long-term protection of great apes and other wildlife in the Sangha Tri-National Landscape through increased transboundary surveillance and law-enforcement.,,"2.987, 16.223"
measle_brown,Grate Ape,96200-1-G115,Wildlife Conservation Society,"Developing a strategic plan to conserve the great apes of the Ndoki Landscape, Republic of Congo","$63,560.00","$29,355.00",GA-0770,Congo,"This project will develop a unified conservation strategy to implement a landscape approach to conserving great apes, elephants, and other wildlife in the Ndoki Landscape of the Republic of Congo.",,"2.506, 16.616"
measle_brown,Grate Ape,96200-1-G180,International Conservation and Education Fund,Great ape public awareness project using video-centered education outreach,"$84,304.00","$116,314.00",GA-0810,Congo,"This project will raise awareness of rural communities to conserve great ape populations in the Northern Republic of Congo.  The grantee will use a participatory approach involving screenings and dissemination of video to reduce illegal bushmeat hunting, ritual wildlife killings, habitat destruction, and disease transmission.",,"1.4344, 16.2283"
measle_brown,Grate Ape,96200-1-G185,Wildlife Conservation Society,Goualougo Triangle Ape Project: developing conservation policies and local leadership to ensure the long-term survival of chimpanzees and gorillas,"$194,689.00","$169,572.00",GA-0833,Congo,"This grant will support the development of professional capacity to implement conservation programs, enhanced surveillance and protection to ape populations in an active logging concession, and an expanded conservation outreach program.",,"2.117, 16.528"
measle_brown,Grate Ape,96200-1-G193,International Conservation and Education Fund,Digital media as a mobile education tool to decrease hunting  and consumption of bushmeat and bonobos in the Salonga-Lukenie-Sankuru Landscape,"$116,391.00","$151,929.00",GA-0861,Congo,This project will conserve bonobo populations in Salonga National Park using a participatory approach that involves film screenings and distribution in local languages to reduce bushmeat hunting among rural communities in the Equateur province of the Democratic Republic of Congo.,,"-2.105, 21.304"
measle_brown,Grate Ape,96200-1-G196,Wildlife Conservation Society,"Great ape conservation and monitoring in the Lac Tele Landscape, Republic of Congo","$183,876.00","$100,775.00",GA-0832 Africa,Congo,"This grant will support the conservation of populations of great apes and elephants in the Lac Tele Community Reserve through a program of law enforcement, evaluation of conservation impact, and training.",,"1.189, 17.23"
measle_brown,Grate Ape,96200-1-G021,Wild Chimpanzee Foundation-Africa,Tai-Sapo Complex: (Cote d'Ivoire - Liberia) improving the conservation of the last remaining West African Chimpanzees,"$295,478.00","$277,080.00",GA-0766,Cote d'Ivoire/Ivory Coast,"This project will implement a transboundary conservation program to improve management of protected areas throughout the complex with an emphasis on training, monitoring, law enforcement, and community outreach and education.",,"5.809, -7.154"
measle_brown,Grate Ape,96200-1-G033,Wildlife Conservation Society,"Conservation of Grauer's gorillas in the Kahuzi-Biega National Park, Democratic Republic of Congo","$84,832.00","$81,606.00",GA-0772,DRC,This project will increase the law enforcement and community outreach capacity of the Congolese Institute for Nature Conservation in the lowland sector of Kahuzi-Biega National Park.,,"-1.963, 28.019"
measle_brown,Grate Ape,96200-1-G103,"Lukuru Wildlife Research Foundation, Inc",Community drafting and acceptance of conservation zoning across the Tshuapa-Lualaba (TL2) landscape.,"$150,000.00","$485,858.00",GA-0802,DRC,This project will create new protected areas in the Tshuapa-Lualaba landscape through a participatory process of local zoning and the creation of a national park.,,"-0.939, 24.804"
measle_brown,Grate Ape,96200-1-G181,Les Amis des Bonobos du Congo,Zamba ya bonobo - expanding the educational and conservation impact of the reintroduction program at Ekolo Ya Bonobo,"$19,988.00","$12,358.00",GA-0814,DRC,This project will determine the feasibility of a community based eco-tourism scheme for bonobos in Democratic Republic of Congo.,,"1.1897, 19.7572"
measle_brown,Grate Ape,96200-1-G194,Max Planck Institute for Evolutionary Anthropology,"Improving in-situ conservation of bonobos (Pan paniscus) by envrionmental education and capacity building in schools and villages West of Salonga National Park, Democratic Republic of Congo","$55,585.00","$44,382.00",GA-0806,DRC,"This project will reduce illegal hunting and habitat degradation in Salonga National Park through an environmental education program among rural communities in the Bandundu province, Democratic Republic of Congo.",,"-2.105, 21.304"
measle_brown,Grate Ape,96200-1-G195,Wildlife Conservation Society,Protecting the eastern chimpanzee in northern Katanga forests (Kabogo Forest and Luama Hunting Reserve) through community engagement,"$98,090.00","$47,916.00",GA-0830 Africa,DRC,This grant will support the conservation of the chimpanzee population in the Ngamikka-Luama Landscape by engaging and building the capacity of local communities.,,"-5.49, 29.226"
measle_brown,Grate Ape,96200-1-J011,Africa Conservation Fund,Virunga National Park Rangers' and Widows' Fund,"$132,764.00","$130,040.00",GA-0813 Africa,DRC,This cooperative agreement will improve ranger morale through the creation of a fund to provide support to the widows of park rangers killed in the line of duty.,,"-1.375, 29.429"
measle_brown,Grate Ape,96200-1-G112,Max Planck Institute for Evolutionary Anthropology,"Conservation and research of western gorillas in Loango National Park, Gabon","$78,755.00","$58,800.00",GA-0778,Gabon,"This project will provide an effective deterrent to poaching in Loango National Park through regular surveillance for illegal activities, strategic monitoring of gorillas and other large mammals.  It will also strengthen national capacity for science-based conservation and adaptive management, and conservation education.",,"-2.118, 9.592"
measle_brown,Grate Ape,96200-1-G197,Protector of Great Apes of Moukalaba,"Building capacity for the conservation of great apes in the Moukalaba-Doudou National Park, Gabon","$58,605.00","$110,030.00",GA-0849 Africa,Gabon,This project will secure the eastern border of Moukalaba-Doudou through community-based ecotourism activities and a targeted environmental education campaign.,,"-2.456, 10.415"
measle_brown,Grate Ape,96200-1-G200,Zoological Society of London,Conserving the great apes of the Djoua-Zadie-Mwagna area of northeast Gabon,"$49,865.00","$25,567.00",GA-0760,Gabon,This project will facilitate the development and implementation of an action plan to conserve great apes and forest elephants in the Djoua-Zadia-Mwanga area of Gabon.,,"0.473, 13.775"
measle_brown,Grate Ape,96200-1-G290,Wildlife Conservation Society,Protecting Gabon's great ape populations via improved law enforcement,"$119,711.00","$75,024.00",GA-0858 Africa,Gabon,This project will improve the effectiveness of national parks and help to conserve their great ape populations by supporting and independently monitoring the efforts of the Gabonese National Parks Agency (ANPN).,"NOTE: Split funding, $43,125 USAID and $76,586 GACF","-0.525, 11.542"
measle_brown,Grate Ape,96200-1-G109,Primate Research Centre,"Conservation of western Hoolock gibbon in Langlakso-Mikir Hills-Koliyoni and Marat Longri-Patradisa-Longnit Priority Landscapes, Assam, India","$51,948.00","$22,260.00",GA-0767,India,"This project will gather information needed to improve management of gibbons and their habitats and develop public support for gibbon conservation. The grantee will conduct a population estimation and demographic status survey of significant habitats in these landscapes, assessing vegetation and mapping gibbon habitat and the extent of fragmentation.  Awareness camps for schools and outdoor nature orientation camps on gibbon conservation will be organized for fringe villages.",,"26.634502, 93.398132"
measle_brown,Grate Ape,96200-1-G234,AARANYAK,"Training of frontline staff for Hoolock gibbon conservation in the state of Arunachal Pradesh, India","$49,995.00","$38,749.00",GA-0812 Asia,India,"This project will train foresters to manage the gibbon habitat within their work area.  They will learn about the importance of the species and its habitat, the legal protection afforded gibbons and other wildlife by Indian law, how to conduct gibbon population estimates, how to protect gibbons through patrolling and outreach education, and how to identify, age and sex gibbons and other primates.",,"28.13847, 95.811615"
measle_brown,Grate Ape,96200-1-G237,Wildlife Areas Development and Welfare Trust,"Training on habitat management and wildlife conservation for the front line forest personnel of the Protected Areas of Northeast India, Phase III","$45,516.00","$86,880.00",GA-0825,India,"This grant will support training for ground level forest staff of the protected areas of Assam in modern techniques of wildlife conservation and habitat management, including anti-poaching techniques.  Emphasis will be given to the conservation of gibbons, other primates, tigers, elephants and rhinos.  Courses will vary in length from three days to two weeks and will reach a total of 250 trainees.",,"26.149591, 91.651145"
measle_brown,Grate Ape,96200-1-G098,Australian Orangutan Project,"Support for wildlife protection units in the Bukit Tigapuluh ecosystem, Jambi, Sumatra to protect the critically endangered Sumatran orangutan (Pongo abelii)","$44,999.00","$3,190.00",GA-0774,Indonesia,This project will provide basic ranger training to recruits to establish two additional wildlife protection units.  A vehicle for transportation of the units to their patrol areas will also be provided.  This is needed to strengthen the patrol network of the Bukit Tigapuloh Ecosystem.,,"-0.848968, 102.416992"
measle_brown,Grate Ape,96200-1-G100,Frankfurt Zoological Society,Orangutan protection patrols and orangutan population monitoring in the Bukit Tigapuluh Landscape,"$39,684.00","$223,054.00",GA-0785,Indonesia,This grantee will establish two new four person patrol teams to monitor recently released orangutans and conduct a landscape-wide orangutan distribution survey.  The project will protect the orangutans and their habitat in the buffer zone of the park where forest encroachment and illegal logging are still common.,,"-1.12881, 102.306404"
measle_brown,Grate Ape,96200-1-G102,Wildlife Conservation Society,Orangutan conservation through effective law enforcement and media support,"$61,176.00","$63,328.00",GA-0747,Indonesia,"This project will increase the orangutan population of northern Sumatra by decreasing orangutan poaching, human-orangutan conflict, and habitat fragmentation and loss.  The grantee will conduct wildlife crimes investigations, provide legal case advice to government authorities, conduct human-wildlife conflict patrols, and raise awareness of orangutan conservation using the mass media.",,"2.514451, 97.750854"
measle_brown,Grate Ape,96200-1-G110,PanEco Foundation,"New Sumatran orangutan (Pongo abelii) nest surveys to determine its current distribution, density and abundance","$81,615.00","$161,870.00",GA-0788,Indonesia,"This project will provide an update on the distribution, density and abundance of the Sumatran orangutan in the Leuser Ecosystem.  The Leuser Ecosystem is by far the most important area for the conservation of the Sumatran orangutan and is estimated to contain 88% of the species’ population.  This estimate is, however, based on data from 1990-2001 and is therefore in urgent need of an update because deforestation, degradation and fragmentation have all continued to impact orangutans during the past decade.",,"3.088103, 97.781067"
measle_brown,Grate Ape,96200-1-G168,"Rutgers, The State University of New Jersey","The integration of environmental education and long-term research to increase conservation awareness in communities surrounding the Tuanan Orangutan Research Station, Mawas Area, Central Kalimatan","$48,219.00","$63,448.00",GA-0775,Indonesia,"This project will support orangutan conservation surrounding the Tuanan Orangutan Research Station by implementing an environmental education program in local communities.  The grantee will develop a curriculum for the local school system, provide the communities with up-to-date information on relevant environmental issues and the research findings of the station, and continue to integrate local community members into the research efforts of the Tuanan Research Area.",,"-2.146657, 114.43428"
measle_brown,Grate Ape,96200-1-G233,Yayasan Cipta Citra Lestari Indonesia,"Long-term home range size, habitat use, and the effect of habitat disturbance on Sumatran orangutans","$17,264.00","$21,319.00",GA-0811,Indonesia,"This project will provide an improved understanding of the ranging patterns and long-term spatial needs of the Sumatran orangutan.  The grantee will analyze 35 years of data from Ketambe Research Station using modern GIS tools to determine the orangutan’s long-term home range size, habitat use patterns, the effects of habitat disturbance on ranging, and behavioral response to habitat change.",,"3.66786, 97.656441"
measle_brown,Grate Ape,96200-1-G241,Orangutan Tropical Peatland Project [OUTROP],"Ecological monitoring as a tool for ape conservation: assessing the effectiveness of conservation initiatives in Sabangua, Central Kalimantan","$56,395.00","$82,714.00",GA-0842,Indonesia,This grant will initiate long-term monitoring of factors relevant to orangutan and gibbon conservation in the Peat Swamp Forest Natural Laboratory located in the Sebangau Swamp and immediately adjacent to Sebangau National Park.  This research will provide feedback on the effectiveness of conservation initiatives to management agencies. The project will also assess the utility of LiDar as a tool for monitoring changes in forest biomass.,,"-2.380906, 113.895264"
measle_brown,Grate Ape,96200-1-G096,Fauna and Flora International,"Enhancing conservation of the western black-crested gibbon at Nam Kan National Protected Area, Lao PDR","$56,295.00","$7,381.00",GA-0751,Laos,"This project will improve understanding of the status of the black-crested gibbon in the Bokeo Province portion of Nam Kan National Protected Area to support management planning.  The grantee will determine the distribution and status of this species as well as the threats to its survival in the area, and by raising awareness and pride among local communities about the global significance of this gibbon.",,"20.61022, 100.746002"
measle_brown,Grate Ape,96200-1-G236,Wildlife Conservation Society,"Northern white-cheeked gibbon (Nomascus leucogenys) conservation through concentrated protection in the Nam Et Phou Louey National Protected Area Core Zone, Huaphan Lao PDR","$54,223.00","$53,417.00",GA-0848,Laos,"This project will concentrate enforcement interventions in areas of the National Protected Area core zone to conserve globally significant populations of the northern white-cheeked gibbon.  The grantee will strengthen and equip five substations nearest to the high-risk areas for gibbons in the National Protected Area, and increasing the patrolling effort in and near the gibbon territories.",,"20.444743, 103.634033"
measle_brown,Grate Ape,96200-1-G182,Fauna and Flora International,Strengthening West African chimpanzee conservation through rebuilding capacity in post-conflict Liberia,"$49,565.00","$83,320.00",GA-0821,Liberia,This project will develop an applied research program at Sapo National Park and increase conservation capacity in Liberia through a revision of core conservation curriculum at the country’s two universities.,,"5.488, -8.389"
measle_brown,Grate Ape,96200-1-G105,North Carolina Zoological Society,Improved protection for the Cross River gorilla at Nigeria's Afi Mountain Wildlife Sanctuary enhanced law enforcement action and monitoring,"$48,470.00","$57,800.00",GA-0801,Nigeria,"This project will conserve the Cross River gorilla and other wildlife at Afi Mountain Wildlife Sanctuary through reduction of hunting and other illegal activities.  The grantee will increase the frequency, duration, coverage, and efficacy of anti-poaching patrols.",,"5.75, 8.55"
measle_brown,Grate Ape,96200-1-G243,International Institute for Environment and Development,Linking great ape conservation and poverty alleviation: sharing experience from Africa and Asia,"$48,875.00","$40,000.00",GA-0835 Asia,Range states,This project will build the capacity of organizations concerned with the conservation of great apes to address and better integrate poverty alleviation into their implementation strategies.  The grantee will organize a workshop in Indonesia that brings together conservation practitioners from Asia and Africa to exchange experience on linking ape conservation with poverty alleviation.  The project will also explore collating a set of “Best Practice Guidelines” for publication by the Primate Specialist Group of  IUCN.,,"-6.55277, 106.753078"
measle_brown,Grate Ape,96200-1-G104,International Gorilla Conservation Programme,Transboundary mountain gorilla habitat protection and surveillance: support to a Regional Information System in the Virunga-Bwindi Forest Ecosystem,"$59,915.00","$157,024.00",GA-0779,Rwanda,"This project will improve park management by supporting ranger based monitoring teams to collect data on the location, intensity, and type of threats impacting mountain gorillas.",,"-1.526, 29.599"
measle_brown,Grate Ape,96200-1-G123,Wildlife Conservation Society,Conserving Nyungwe's chimpanzees through education and outreach,"$58,103.00","$61,936.00",GA-0769,Rwanda,"This project will create a long-term constituency in support of chimpanzee conservation around Nyungwe National Park through teacher training, primary school education, community outreach, and the production of outreach materials.",,"-2.419, 29.152"
measle_brown,Grate Ape,96200-1-G124,PCI Media Impact,My Chimpanzee-My Community,"$63,208.00","$42,788.00",GA-0790,Rwanda,"This project will complement outreach activities conducted by the Wildlife Conservation Society and Rwandan park authorities to positively change community knowledge, attitudes, and behaviors related to chimpanzees.  The grantee will conduct a radio theatre campaign designed to strengthen engagement in protecting Nyungwe National Park.",,"-2.419, 29.152"
measle_brown,Grate Ape,96200-1-G186,PCI Media Impact,Conservation of chimpanzee habitats: an entertainment-education strategy for protecting Western chimpanzees in post-war Sierra Leone and Liberia,"$99,000.00","$51,944.00",GA-0850 Africa,Sierra Leone,"This project will reduce threats to chimpanzees by building the capacity of local organizations to implement an awareness campaign, including a regional radio serial drama.",,"3.6, -10.797"
measle_brown,Grate Ape,96200-1-G198,Jane Goodall Institute,Using new technologies in chimpanzee censusing to inform landscape-scale habitat management in western Tanzania,"$68,188.00","$39,995.00",GA-0818,Tanzania,"This project will identify and conserve critical chimpanzee habitats in the Masito-Ugalla ecosystem in Western Tanzania using a unique combination of remote acoustic monitoring technologies, non-invasive genetic analysis, field surveys, and GIS methods.",,"-6.162, 30.053"
measle_brown,Grate Ape,96200-1-G095,World Wildlife Fund-Thailand,Saving endangered pileated gibbons through conservation education/awareness in southeast Thailand,"$49,800.00","$19,615.00",GA-0749,Thailand,"This project will increase the globally significant population of endangered pileated gibbons in Khao Ang Rue Nai Wildlife Sanctuary by assessing threats to the gibbon population, building capacity for sanctuary management, and through conservation education and outreach.  Outreach will include a gibbon painting contest, gibbon exhibits at schools, a brochure on gibbon ecology/conservation, and a permanent exhibit on gibbons at the sanctuary head office and ranger station.",,"13.251902, 101.750488"
measle_brown,Grate Ape,96200-1-G106,Budongo Conservation Field Station,Establishing a national chimpanzee disease and health monitoring programme in Uganda,"$29,469.00","$94,415.00",GA-0763,Uganda,"This project will minimize the threat of disease transmission between humans and chimpanzees in Uganda through a standardized national chimpanzee health monitoring protocol, establishment of a veterinary center, and training for wildlife veterinarians.",,"1.724, 31.544"
measle_brown,Grate Ape,96200-1-G179,"Village Enterprise Fund, Inc.","Integrated conservation and microenterprise development model: the Budongo Program, Uganda","$50,000.00","$139,000.00",GA-0808 Africa,Uganda,"This project will support alternative livelihood programs to conserve the chimpanzee population in the Budongo forest reserve.  The programs will shift human activities away from existing practices toward sustainable methods of food protection, livestock rearing, retail operations, and eco-tourism support.",,"1.724, 31.544"
measle_brown,Grate Ape,96200-1-G183,"University of Georgia Research Foundation, Inc","Close-contact pathogens, sexually transmitted diseases, and African ape conservation","$31,292.00","$34,920.00",GA-0826,Uganda,This project will reduce the transmission of sexually transmitted diseases from sanctuary chimpanzees to wild chimpanzees. The grantee will analyse how chimpanzee mating patterns affect pathogen transmission to develop targeted vaccination and/or treatment strategies.,,"0.485, 30.389"
measle_brown,Grate Ape,96200-1-G094,Wildlife Conservation Society,Analyzing trade dynamics and raising political awareness and commitment to eliminate the illegal trade in yellow-cheeked crested Gibbons (Nomascus concolor) and other endangered species in Southern Vietnam,"$58,937.00","$55,392.00",GA-0746,Vietnam,This project will provide accurate and detailed analysis of illegal trade dynamics in yellow-cheeked crested gibbons and other endangered species in the Ho Chi Minh City Metropolitan area.  This information will be used to raise political awareness and commitment to eliminate the illegal trade in gibbons and to plan strategies to prevent these crimes.,,"10.85069, 106.627655"
measle_brown,Grate Ape,96200-1-G101,Centre for Natural Resources and Environmental Studies (CRES),Conservation training and survey for the critically endangered white-cheeked gibbon (Nomascus leucogenys) in Vietnam's northwest provinces,"$49,940.00","$8,750.00",GA-0737,Vietnam,"This project will enhance capacity to conserve the white-cheeked gibbon among local conservation practitioners at key sites. The grantee will train forest rangers, protected area staff and local conservation activists from the vicinity of four priority sites in gibbon survey and monitoring methods.  The grantee will also carry out a field survey and raise local awareness of the need to protect gibbons.",,"22.258314, 102.521362"
measle_brown,Grate Ape,96200-1-G238,Fauna and Flora International,Census of the transboundary Cao Vit gibbon population and review of protected area management planning,"$53,404.00","$19,381.00",GA-0851,Vietnam,"This project will improve scientific knowledge of the population dynamics of the gibbon.  This is needed to steer conservation interventions and build capacity for management of the Cao Vit Gibbon Conservation Area in Vietnam.  With a global population of about 110 individuals remaining in only one forest area on the border of northeast Vietnam and southern China, the cao vit gibbon is one of the world’s rarest primates.",,"22.861975, 106.421509"
measle_brown,Grate Ape,96200-1-G242,Douc Langur Foundation,"Safeguarding viable populations of Critically Endangered gibbons at Chu Mom Ray National Park, Vietnam","$28,147.00","$31,285.00",GA-0860 Asia,Vietnam,"This project will reduce the killing, trapping and illegal trade of yellow-cheeked crested gibbons in the vicinity of the park and initiate protection of the gibbons and their habitat.  The grantee will carry out a gibbon survey, form rangers into Gibbon Protection Teams, train and deploy the teams to patrol, and monitor the patrol effort.",,"14.504417, 107.620621"
Small_red,Africa,96200-1-J001,,,"$10,000.00",,AFR-0139,,"NOTE: $10,000 funding from GACF-8884 for Africa Grant #96200-1-J001, total $120,000, see Africa summary for details, doesn't count as GACF grant.",,","
