symbol,Program,Grant Number,Partner Organization,Project Title,Award Amount:,Leveraged Funds:,Proposal_Number,Country,Summary,Notes,coordinates
small_blue,Rhino Tiger,96200-1-G166,Peking University - College of Life Sciences,Using DNA to track the origin of tiger parts from illegal trade in Asia,"$50,600.00","$32,000.00",RT-1158,China,"This project will build an effective communication network for Chinese wildlife law enforcement authorities.  It will provide training workshops for CITES, Customs, and Forest Police on illegal tiger trade and wildlife forensic analysis.  These groups will collect and carry out forensic analysis on representative specimens of tiger parts confiscated from illegal trade for the years 2000-2010 as well as from upcoming seizures.  By elucidating the origins and routes of the illegal trade in tiger parts entering China, this project will provide information needed for more effective law enforcement operations against poachers and illegal traders operating in China and internationally.","This is a very geographically broad project, spanning across the entire range of illegal tiger parts trade.",","
small_blue,Rhino Tiger,96200-1-G167,The Bhutan Foundation,Conserving a source population of tigers - monitoring tigers and other wildlife in Bhutan's Royal Manas National Park,"$50,000.00","$42,000.00",RT-1145,Bhutan,"This project will strengthen Bhutan’s capacity to monitor tigers, other carnivores and prey populations in the park in order to detect trends and influence timely management decisions.  The grant will support Bhutan’s Ugyen Wangchuck Institute for Conservation and Environment in developing and validating tiger population density and habitat estimates for the park.  The capacity developed under this project will then be used to scale up monitoring of tigers and their prey in other protected areas of Bhutan.",,"27.029091, 90.713348"
small_blue,Rhino Tiger,96200-1-G187,Fauna and Flora International,"Ensuring protection of the black rhino population at Ol Pejeta Conservancy, Kenya","$83,267.00","$104,406.00",RT-1171,Kenya,"This grant will support the upgrading of the regional radio security network to a modern, digital standard.  The grantee will improve on-site housing for rangers and support staff training at Ol Pejeta Conservancy, home to one of Kenya's largest black rhino populations.",,"0.172271, 36.746521"
small_blue,Rhino Tiger,96200-1-G188,Save the Rhino International,"Improving rhino crime investigation and prosecution in state, community and private land areas of Kenya and Namibia","$24,585.00","$54,005.00",RT-1172,Kenya and Namibia,"This grant will support training courses designed to improve conviction rates for rhino poaching in Kenya and Namibia.  Courses will include training for wildlife officers in investigating and securing evidence from wildlife crime scenes, properly handling evidence for prosecution, and better conveying the severity of poaching and its impact to other influential partners (including police, military, and the judiciary).",,"0.381009, 36.78627"
small_blue,Rhino Tiger,96200-1-G189,International Rhino Foundation,Improving rhino protection in selected protected areas in Zimbabwe and the Republic of South Africa,"$30,090.00","$25,000.00",RT-1173,Zimbabwe and South Africa,"This grant will support security needs assessments of several rhino habitats in Zimbabwe and South Africa, including both private and national park land.  Based on the assessments, equipment and training will be provided to improve patrolling ability and, in the event of poaching, to properly collect forensic evidence and conduct investigations to improve prosecution rates.",,"-18.855466, 27.387695"
small_blue,Rhino Tiger,96200-1-G190,The Wildlife & Environment Society of Southern Africa (Lowveld region),Emergency support to the Mpumalanga Tourism and Parks Agency for white rhino conservation,"$24,999.00","$66,860.00",RT-1086,South Africa,"This project will support rhino monitoring, tracking, and immobilization of as many as 110 rhinos (to insert transmitters or conduct dehorning, where necessary, and to collect DNA samples) in Manyeleti, Andover and Loskop nature reserves in Mpumalanga Province, South Africa.",,"-24.635714, 31.513596"
measle_turquoise,Marine Turtle,96200-1-G117,MARINELIFE ALLIANCE,Community-based sea turtle research and conservation project in Bangladesh,"$24,999.00","$32,450.00",MT 11-040,Bangladesh,"This grant will continue a community-based conservation project and extend the project another 150 km on the Teknaf Peninsula, St. Martin and Sonadia Islands. Community members will be trained to conduct field work and 1,000 fisherman will be trained in identification of sea turtles, safe handling, and release techniques for accidentally captured sea turtles.",,"21.817034, 91.858406"
measle_turquoise,Marine Turtle,96200-1-G069,University of the West Indies,Building capacity for conservation of hawksbill turtles in Barbados,"$36,300.00","$68,400.00",MT 11-043,Barbados,"This grant will continue long-term conservation programs at key hawksbill nesting beaches in Barbados, which hosts one of the three largest hawksbill nesting populations in the Caribbean.",,"13.258901, -59.559975"
measle_turquoise,Marine Turtle,96200-1-G171,Fauna and Flora International,Marine turtle conservation and assessment in Cambodia,"$25,000.00","$58,148.00",MT 11-066,Cambodia,"This project will protect marine turtle nesting sites at Koh Tang Island through field surveys at target sites, academic and technical capacity building of Cambodian researchers, and awareness workshops in key areas.",,"10.300052, 103.133421"
measle_turquoise,Marine Turtle,96200-1-G061,"Turtle Foundation, USA","Protecting loggerhead turtle (Caretta caretta) nesting Beaches on Boavista Island, Cape Verde (2011)","$57,000.00","$183,384.00",MT 11-021,Cape Verde,This grant will support night patrols in collaboration with the military to protect nesting loggerhead females from rampant illegal slaughter on important nesting beaches on the Cape Verde Island of Boa Vista.  This island hosts about 90% of the Cape Verde nesting population.  The project will also involve a public awareness campaign in schools and communities throughout the island.,,"16.029609, -22.960052"
measle_turquoise,Marine Turtle,96200-1-G062,ADTMA - SOS Tartarugas,"Protection of nesting loggerhead turtles and beaches in Cabo Verde, Africa","$49,803.00","$86,686.00",MT 11-028,Cape Verde,"This grant will support night patrols on the most important loggerhead nesting beaches on the island of Sal to prevent killing of nesting females.  The project will provide training for local Cape Verdians to carry out marine turtle conservation on the islands of Sal, Maio and San Nicolau.  The grant will also support conservation outreach activities on Sal to local and municipal government, police, military, local citizens and tourists.",,"16.601612, -22.894135"
measle_turquoise,Marine Turtle,96200-1-G065,Cabo Verde Natura 2000,Effective protection of loggerhead females and nests in higher density nesting area of the Archipelago of Cabo Verde,"$67,480.00","$162,520.00",MT 11-036,Cape Verde,"This grant will support field staff and provide material support for two field camps that effectively protect about 75% of the nesting turtles on the Island of Boa Vista, which accounts for 90% of the Cape Verde loggerhead nesting population. The grantee will also organize the annual meeting of the Cape Verde Sea Turtle Coalition, and engage with fisherman to investigate the extent of bycatch and turtle meat trafficking in Cape Verde.",,"16.050964, -22.682095"
measle_turquoise,Marine Turtle,96200-1-G175,Sea Turtle Conservancy,"Sea turtle research, conservation and capacity building at Tortuguero, Costa Rica","$20,000.00","$370,697.00",MT 11-046,Costa Rica,"This project will build capacity in Latin America and the Caribbean through Sea Turtle Conservancy's Tortuguero training program in marine turtle research and management techniques, community involvement and ecotourism.  The training will be targeted to regional biologists, natural resource managers and community leaders.",,"10.540546, -83.500986"
measle_turquoise,Marine Turtle,96200-1-G292,Fundacion para el Equilibrio entre la Conservacion y el Desarrollo (FUNDECODES ),"Conservation project of leatherback nesting on the North Pacific coast of Costa Rica, Langosta Beach","$24,999.00","$1,650.00",MT 11-067,Costa Rica,"This grant will support nesting beach conservation programs for Playa Langosta, one of the two key East Pacific leatherback nesting beaches in Costa Rica.",,"10.39344, -85.835218"
measle_turquoise,Marine Turtle,96200-1-G145,SOS-Forets,Conservation of marine turtles of Mani beach (Ivory Coast-West Africa),"$18,000.00","$30,650.00",MT 11-051,Cote d' Ivoire,"This project will involve local communities and university students to monitor and protect nests from poaching along an 18 km stretch of important leatherback nesting beach in Cote d’Ivoire, with an estimated 700 sea turtle nests annually.  The grantee will also conduct environmental education outreach with local communities.",,"4.42581, -7.334938"
measle_turquoise,Marine Turtle,96200-1-G227,Action Communautaire de Development et d'Encadrement Social (ACODES),Protection and study of nesting sea turtles on the coastline of the Democratic Republic of Congo,"$7,500.00",$725.00,MT 11-035,Democratic Republic of Congo,"This grant will support patrols and protection of sea turtle nests along the 40 km coastline of the Democratic Republic of Congo.  The grantee will work with coastal fishing communities to release sea turtles accidently captured in fishing nets, and conduct environmental outreach activities in coastal communities.",,"-5.90091, 12.308769"
measle_turquoise,Marine Turtle,96200-1-G226,Instituto Nacional Desarrollo Forestal y Manejo del Sistema de Areas Protegidas(INDEFOR),Equatorial Guinea 2011-2012; challenges and opportunities for sea turtle conservation,"$24,999.00","$30,500.00",MT 11-044,Equatorial Guinea,"This grant will support a community-based conservation project at Bioko Island which hosts one of the most important leatherback nesting populations in West Africa.  It will also support development of a marine turtle conservation program on important mainland nesting beaches at Rio Campo, and a national outreach campaign.",,"2.265835, 9.790516"
measle_turquoise,Marine Turtle,96200-1-G230,Wildlife Conservation Society,"The Gabon Sea Turtle Partnership for leatherback research and conservation, 2011-2012","$165,000.00","$67,098.00",MT 11-073,Gabon,"This grant will support nesting beach conservation programs for one of the two largest leatherback nesting populations in the world, through an alliance of National Park, NGO and local community participants.  The project will increase capacity of the  National Agency for National Parks to address sea turtle bycatch from legal and illegal coastal fisheries within and adjacent to coastal National Parks.","NOTE: Split funding $125,000 AID and $40,000 MTCF","3.245534, 8.543587"
measle_turquoise,Marine Turtle,96200-1-G051,Wildlife Conservation Society,"Sea turtle technical assistance in the Gulf of Guinea, West Africa 2011-2012","$43,195.00","$31,856.00",MT 11-015,"Gabon, Repubublic of Congo, Sao Tome, Equatorial Guinea","This grant will support on site coordination of the Gabon Sea Turtle Partnership.  The grantee will provide technical support for high priority sea turtle projects in Congo, Gabon, Sao Tome and Principe and Equatorial Guinea, and support efforts with local Benga communities in Corisco Bay, Gabon to address unsustainable sea turtle harvest practices.","This project spans the entire habitat range of marine turtles found throughout the Gulf of Guinea (Gabon, Congo, Ivory Coast, São Tome and Principe, Equatorial Guinea).","3.730272, 3.710937"
measle_turquoise,Marine Turtle,96200-1-G116,Loma Linda University,Community-based capacity building for hawksbill conservation and population recovery in Caribbean Honduras,"$25,422.00","$28,319.00",MT 11-017,Honduras,This grant will support community training in conservation project development at historically important hawksbill nesting beaches on the Caribbean coast of Honduras.  The grantee will also conduct extensive outreach to raise public awareness and gain greater support for sea turtle conservation.,,"16.121559, -86.934471"
measle_turquoise,Marine Turtle,96200-1-G012,Madras Crocodile Bank Trust,"Towards long-term monitoring of olive ridley arribadas in Orissa, India","$10,000.00","$7,130.00",MT 11-009,India,"This project will focus conservation efforts on the Rushikulya nesting beach, which has supported arribada nesting between 80,000 and 100,000 nesting females. The grantee will train community members to conduct nesting surveys, assessing hatching and nesting success to help manage threats.  The community members will also survey sea turtle strandings to document bycatch mortality and support efforts to press for fisheries management.",,"19.374276, 85.084953"
measle_turquoise,Marine Turtle,96200-1-G172,Madras Crocodile Bank Trust,Strengthening the network for monitoring and conservation of sea turtles in India,"$45,000.00","$45,000.00",MT 11-049,India,"This grant will support the 4th Annual National Workshop for network members throughout India to review action plans and assign specific responsibilities for implementation.  The workshop will provide training and support for standardized monitoring protocols at index beaches, including standardized surveys of the olive ridley arribada nesting population at Rushikulya during the 2011-12 nesting season--one of the eight remaining large olive ridley nesting populations in the world.",This project spans all coastal states of India.,","
measle_turquoise,Marine Turtle,96200-1-G063,The State University of Papua (UNIPA),"Conservation of the leatherback nesting population at Jamursba Medi and Wermon Beaches – Papua, Indonesia","$66,000.00","$144,700.00",MT 11-030,Indonesia,This grant will support conservation of the largest remaining Western Pacific leatherback nesting population and ensure the effective involvement of local communities in a recovery program.,,"-0.35713, 132.492371"
measle_turquoise,Marine Turtle,96200-1-G228,Save My Future Foundation,Community-based sea turtle conservation project-Liberia,"$30,000.00","$1,250.00",MT 11-063,Liberia,"This grant will support continuation of community efforts to protect nesting leatherback, hawksbill and olive ridley sea turtles along 13 km of nesting beach. It is the only sea turtle conservation project operating within Liberia.",,"5.429098, -9.579482"
measle_turquoise,Marine Turtle,96200-1-G169,Chelonee,Knowledge and conservation of sea turtles nesting on the coasts of Mauritania,"$20,000.00","$76,472.00",MT 11-054,Mauritania,This grant will support continuation of surveys of the 750 km Mauritanian coast to verify reports of nesting loggerheads and green turtles.  The project will implement awareness campaigns in coastal villages and involve local communities in developing community-based conservation programs in accordance with survey findings.,,"20.310465, -16.276283"
measle_turquoise,Marine Turtle,96200-1-G011,"Kutzari, Asociacion para el Estudio y Conservacion de las Tortugas Marinas, A.C.",Conservation of the leatherback in the Mexican Pacific 2010-2011 - Phase 2,"$65,235.00","$79,267.00",MT 11-042,Mexico,This grant will support expanded nesting beach conservation during the 2010-11 nesting season at two important nesting sites which have been difficult to access logistically.  The project will also assess fisheries activities near nesting beaches and develop management recommendations to Mexico’s fisheries regulatory agency that will prevent bycatch mortality of nesting females during the nesting season.,,"16.557081, -98.956757"
measle_turquoise,Marine Turtle,96200-1-G066,"Pronatura Peninsula de Yucatan, A.C.",Conservation of marine turtle nesting beaches at north coast of Yucatan peninsula Mexico,"$24,999.00","$28,850.00",MT 11-018,Mexico,"This grant will support monitoring and nesting beach conservation programs for three major hawksbill nesting beaches in the Yucatan Peninsula, Mexico.  The grantee will also conduct public outreach and awareness programs in communities adjacent to the nesting beaches.",,"21.538755, -87.252731"
measle_turquoise,Marine Turtle,96200-1-G147,Universidad Michoacana de San Nicolas de Hidalgo,"Population recovery of the black turtle of Michoacan, Mexico","$24,999.00","$25,000.00",MT 11-071,Mexico,"This grant will support a community-based nesting beach conservation program for the black turtle at Colola and Maruata Beaches, the two most important nesting beaches for this species in the East Pacific.",,"18.268569, -103.332479"
measle_turquoise,Marine Turtle,96200-1-G177,"Kutzari, Asociacion para el Estudio y Conservacion de las Tortugas Marinas, A.C.",Conservation of the leatherback turtle in the Mexican Pacific season 2011-2012,"$96,615.00","$258,130.00",MT 11-076,Mexico,"This grant will support nest surveys and protection at the four primary leatherback nesting beaches which account for over 40% of leatherback nesting in Pacific Mexico. The grantee will operate turtle camps at the four main nesting beaches of Cahuitan, Tierra Colorada, Mexiquillo and Barra de la Cruz, and conduct daily and nightly patrols along these beaches to protect nests from poaching, depredation and tidal inundation.  The grantee will also conduct a workshop for approximately 20 coastal communities along the Pacific leatherback nesting beaches to facilitate greater community involvement in leatherback conservation.",,"16.557081, -98.956757"
measle_turquoise,Marine Turtle,96200-1-G229,Association Pour La Protection Des Tortues Marines Au Maroc(ATOMM),Building capacity for an effective sea turtle research and conservation program in the Kingdom of Morocco,"$27,000.00","$2,500.00",MT 11-056,Morocco,"This grant will support interviews and ground surveys to determine the status of sea turtle nesting in Morocco.  The grantee will hold workshops for fishers to assist with data collection on sea turtle bycatch, provide outreach to coastal communities and the general public, and conduct training workshops for student, NGO and local biologists to assist with surveys and sea turtle conservation projects.",,"32.878648, -8.863974"
measle_turquoise,Marine Turtle,96200-1-G052,Wildlife Conservation Society,Conservation of marine turtles in Caribbean Nicaragua,"$68,800.00","$68,492.00",MT 11-016,Nicaragua,This grant will support the monitoring and protection of hawksbill nesting populations on 12 of the Pearl Keys and 42 km of beach at El Cocal.  The project will assist local communities to develop and expand conservation of hawksbill and other nesting sea turtles through ecotourism programs for turtle watching.,,"12.466563, -83.383503"
measle_turquoise,Marine Turtle,96200-1-G067,Fauna and Flora International,Conserving Critically Endangered leatherback and hawksbill marine turtles on Nicaragua's Pacific Coast,"$62,000.00","$70,000.00",MT 11-003,Nicaragua,"This grant will support nesting beach conservation programs for the three most important East Pacific leatherback populations in Nicaragua, and a hawksbill conservation program at the recently discovered nesting site at Estero Padre Ramos. This site accounts for 40-50% of all East Pacific hawksbill nesting. The grantee will work closely with local communities and stakeholders as partners in the conservation programs.",,"12.781605, -87.488122"
measle_turquoise,Marine Turtle,96200-1-G042,Environment Society of Oman,"Strategic development of initiatives for marine turtle conservation on Masirah Island, Oman","$95,000.00","$78,320.00",MT 11-039,Oman,"This grant will provide material and logistical support for the Ministry of Environment rangers to monitor population trends for the world’s largest loggerhead nesting population at Masirah Island.  The grantee will also conduct a public outreach program for marine turtle conservation issues in Oman, including outreach to Masirah Island community through a Turtle Celebration event at the beginning of the 2011 loggerhead nesting season.",,"20.431977, 58.838525"
measle_turquoise,Marine Turtle,96200-1-G064,Sea Turtle Conservancy,Hawksbill and leatherback turtle population recovery project in Panama,"$58,175.00","$124,615.00",MT 11-032,Panama,"This grant will support efforts to restore the Chiriqui Beach nesting population of hawksbill turtles, once the largest in the Wider Caribbean, in partnership with the local Ngobe Indian communities. The grantee will provide monitoring and protection of the largest leatherback nesting population in the Western Caribbean.",,"8.855824, -81.585159"
measle_turquoise,Marine Turtle,96200-1-G048,Southeastern Louisiana University,Regional assessment of arribada olive ridley sea turtles,"$39,935.00","$31,026.00",MT 11-007,"Panama, Nicaragua, Costa Rica","This grant will support a continuation of simultaneous regional estimates of the olive ridley arribada nesting populations and hatching rates in Panama, Nicaragua, and Costa Rica using standardized methodology.",,"9.9961, -85.703251"
measle_turquoise,Marine Turtle,96200-1-G201,Marine Research Foundation,"Community-based conservation of leatherback turtles along the Huon Coast, Papua New Guinea 2011-2012","$23,000.00","$66,079.00",MT 11-059,Papua New Guinea,This grant will support community-based nesting beach conservation of the most important leatherback nesting populations in Papua New Guinea and the second most important in the West Pacific.,,"-7.203263, 147.12234"
measle_turquoise,Marine Turtle,96200-1-G231,Inter-American Convention for the Protection and Conservation of Sea Turtles,Support for the Fifth Conference of the Parties of the IAC and the meetings of its subsidiary bodies in the framework of the lAC's 10th Anniversary,"$41,800.00","$40,000.00",MT 11-026,Regional Western Hemishere,This grant will support the Secretariat and Party members of the Inter-American Convention to attend the Fifth Conference of the Parties (COP 5) and Consultative and Scientific Committee meetings.  It will also provide assistance for the Secretariat’s office to coordinate and organize COP 5 and meetings of the Scientific and Consultative Committees.,,"12.143683, -68.275711"
measle_turquoise,Marine Turtle,96200-1-G176,Ocean Ecology Network,"Scientific and technical support to Sierra Leone, Liberia, Cape Verde, Principe, and Morocco","$36,748.00","$36,748.00",MT 11-055,Regional-Africa,"This grantee will provide technical assistance for Marine Turtle Conservation Fund-supported nesting beach projects in Sierra Leone, Liberia, Cape Verde, Principe and Morocco.  The project will build capacity of implementing personnel and institutions in the areas of scientific techniques and community involvement.","This project spans all nesting beaches in Sierra Leone, Liberia, Cape Verde, Principe and Morocco. The coordinates provided is in Liberia, the central location for this region.","5.549602, -9.703255"
measle_turquoise,Marine Turtle,96200-1-G146,Renatura,Marine turtle monitoring and protection in the Republic of Congo,"$24,999.00","$26,192.00",MT 11-070,Republic of Congo,"This grant will support efforts to protect nesting leatherback and olive ridley sea turtles along 20 km of nesting beach adjacent to Conkouati-Douli National Park.  It will also support continuation of a turtle bycatch release program with local fisherman that releases approximately 1,500 turtles annually, and an environmental outreach program with local communities.",,"-4.612111, 11.826172"
measle_turquoise,Marine Turtle,96200-1-G173,Wildlife Conservation Society,"Leatherback conservation program in Republic of Congo, 2011-2012","$68,000.00","$47,083.00",MT 11-068,Republic of Congo,"This grant will support a leatherback conservation program along 60 km of high density leatherback nesting beach within Conkouati-Douli National Park, which is contiguous with the major leatherback nesting population in Mayumba National Park, Gabon.",,"-4.037487, 11.264582"
measle_turquoise,Marine Turtle,96200-1-G170,Conservation Society of Sierra Leone,Continued development of a marine turtle conservation program for Sierra Leone and leatherback conservation initiative at Turtle and Bonthe/Sherbro Islands,"$66,000.00","$10,412.00",MT 11-048,Sierra Leone,"This grant will support community-based conservation programs for marine turtle conservation at key leatherback nesting beaches in Sierra Leone with a special emphasis on community involvement, capacity building, and environmental outreach with fisherman and local communities.",,"8.333692, -13.204086"
measle_turquoise,Marine Turtle,96200-1-G174,The Nature Conservancy,"Leatherback turtle monitoring and conservation at Sasakolo and Lithogagira, Solomon Islands","$25,000.00","$28,638.00",MT 11-061,Solomon Islands,"This grant will support community-based nesting beach conservation programs for the two most important leatherback nesting beaches in the Solomon Islands, which are part of the Critically Endangered West Pacific leatherback nesting population.",,"-7.909516, 158.805569"
measle_turquoise,Marine Turtle,96200-1-G144,International Sea Turtle Society,32nd Annual Symposium on Sea Turtle Biology and Conservation; Marine Turtle Newsletter; Seaturtle.org,"$32,000.00","$68,000.00",MT 11-072,USA,"This grant will support 35 students or individuals from institutions in developing countries, who would not otherwise be able, to attend this meeting of about 1,000 marine turtle researchers, managers, and conservationists.",,"15.763326, -96.098442"
