symbol,Program,Grant Number,Partner Organization,Project Title,Award Amount:,Leveraged Funds:,Proposal_Number,Country,Summary,Notes,coordinates
small_red,Africa,96200-1-J002,Agence Nationale des Parcs Nationaux,MENTOR-FOREST: Building conservation capacity in the Congo Basin - a multi-disciplinary team training program to improve forest stewardship and wildlife conservation,"$599,957.00","$100,000.00",AFR-0141,Gabon and Republic of Congo,"The purpose of this cooperative agreement is to develop an innovative new program to build a team of ten Central African forest resource professionals.  The team will work together to improve upon current forestry programs, identify new forest stewardship strategies and methods, mitigate impacts to wildlife and provide information critical to the sustainable management of forests. MENTOR (Mentoring for ENvironmental Training in Outreach and Resource conservation) is a Wildlife Without Borders Signature Initiative that builds the capacity of teams of African conservationists who can work together to address complex conservation challenges.","This is a very geographically broad project, expanding the entire Congo Basin. The coordinates provided is the central location of the Congo Basin.","-0.126953, 19.902344"
small_red,Africa,96200-1-G001,South African National Parks and University of Pretoria,2011 AHEAD-GLTFCA Working Group Meeting,"$24,999.00","$31,950.00",AFR-0132,Regional -Southern Africa,"The purpose of this project is to bring together stakeholders to strategically plan and provide technical support and resources to address the interface of wildlife health, livestock health, human health and livelihoods for the Great Limpopo Transfrontier Conservation Area (GLTFCA) of South Africa, Mozambique and Zimbabwe.  Through the Animal & Human Health for Environment and Development (AHEAD)-GLTFCA decision-making process, collaborators will design projects to address complex trans-boundary conservation challenges.",,"-23.306386, 31.546631"
small_red,Africa,96200-1-G002,Addis Ababa University and Institute of Biodiversity Conservation,"Training park personnel on fish resource identification and conservation in Alatish National Park, Ethiopia","$24,816.00","$6,160.00",AFR-0081,Ethiopia,"The purpose of this project is to train park personnel in Alatish National Park on diversity, distribution and importance of the fish life of the region.  Park staff will learn methods of sampling, identification, and data collection on fishes in order to improve their conservation and management activities.",,"11.988428, 35.576324"
small_red,Africa,96200-1-G003,Rare Species Conservatory Foundation,Increasing Institutional and Individual Capacity for Crocodile and Hippo Management in Gabon Through the Implementation of a Crocodile Management Unit,"$49,610.00","$36,532.00",AFR-0086,Gabon,"The purpose of this project is to build the capacity of a Crocodile Management Unit within the Gabonese National Parks Agency (ANPN) and the Department of Wildlife to manage and conserve their crocodile and hippopotamus populations in four critical protected areas.  Through workshops and hands-on training, Gabonese personnel will gain an understanding of the threats facing crocodiles and hippopotami, gather data needed to mitigate these threats, assess opportunities for reintroductions, and work on conservation management.",,"0.125122, 9.618378"
small_red,Africa,96200-1-G004,Ecohealth Alliance,Conserving the West African Manatee (Trichechus senegalensis): Capacity Building for Long-Term Success,"$12,081.85","$59,772.00",AFR-0106,Regional-Africa,"The purpose of this project is to build a collaborative network of African researchers and resource managers who can work together to conserve West African manatees in every country in the species range (the African Atlantic coast from Mauritania to Angola, and the interior countries of Mali, Niger and Chad).  Activities include training in manatee fieldwork techniques and provision of needed field equipment in the network members’ countries.  Information on manatees will be disseminated to stakeholders to enable them to make informed decisions regarding the conservation of the West African manatee.","This is a very geographically broad project, expanding the entire habitat range for the manatee in West Africa. The coordinates provided is the central location to the project range.","9.646484, 8.061523"
small_red,Africa,96200-1-G006,Nature Kenya,Planning for the Sustainable Management of Kenya's Tana River Delta,"$43,330.00","$28,850.00",AFR-0108,Kenya,The purpose of this project is to increase Kenya’s capacity to manage the Tana River Delta sustainably by creating a government-led action plan for the delta and by facilitating the implementation of the plan.  Activities include a workshop attended by representatives of all key stakeholder groups; building capacity within civil society to advocate for effective implementation of the plan; and ensuring that the Ramsar designation process for the Tana River Delta is completed as an essential step towards the establishment of a sustainable ‘wise use’ management regime for this vitally important site.,,"-2.405604, 40.249062"
small_red,Africa,96200-1-G008,Zoological Society of London,Building the foundation for a range-wide okapi conservation status assessment,"$93,985.00","$146,517.00",AFR-0114,DRC,"The purpose of this project is to train rangers from the Institut Congolais pour la Conservacion de la Nature (ICCN), the conservation authority of the Democratic Republic of Congo, as part of a major field-based okapi conservation status assessment.  Informative field guides on okapi ecology and public awareness-raising materials will be produced through broader collaborative conservation and community education efforts.",,"3.3934, 25.95459"
small_red,Africa,96200-1-G009,Njala University,"Professional Training in Wildlife Conservation and Protected Area Management 
at Njala University, Sierra Leone","$64,123.00","$12,980.00",AFR-0082,Sierra Leone,"The purpose of this project is for faculty of Njala University to conduct a conservation capacity needs assessment, and develop and implement new in-service training short courses to address identified needs on wildlife conservation and protected area management for individuals working for government agencies, civil society and the private sector.",,"8.110243, -12.075204"
small_red,Africa,96200-1-G014,IUCN-PACO,Capacity Building for improvement of protected areas management in West Africa,"$46,382.00","$45,580.00",AFR-0085,Regional- West Africa,"The purpose of this project is to train 20 conservationists from Mali, Ivory Coast, Benin, Niger and Burkina Faso through a 12-week program on protected area management.  Trainees will learn tools and technical skills that will enable them to better understand conservation challenges and deal with dynamics within and surrounding protected areas in West Africa.","This is a very geographically broad project, expanding all of West Africa. The coordinates provided is the central location to the project range.","9.595935, 8.085327"
small_red,Africa,96200-1-G070,Wildlife Conservation Society,Capacity development for effective management and conservation of cheetah and wild dog populations in Eastern and Southern Africa,"$49,336.00","$37,278.00",AFR-0134,Regional - Eastern and Southern Africa,"This purpose of this project is to improve management of cheetah and wild dog populations in Eastern and Southern Africa.  Activities will include developing course material, conducting a training course for wildlife managers from the range states in the cheetah and wild dog species ranges, and creating a web-based network of managers to share information and experience.","This is a very geographically broad project, expanding throughout several countries in Eastern and Southern Africa. The coordinates provided is Nairobi, Kenya, which is where the project will be based","-1.290422, 36.82272"
small_red,Africa,96200-1-G071,Southern African Wildlife College,Training for Kruger National Park Natural Resource Managers,"$51,541.00","$15,742.00",AFR-0120,South Africa,"The purpose of this project is to support a training effort to improve management of Kruger National Park, South Africa.  Activities will include conducting courses in trans-frontier conservation area management, human-wildlife conflict, and community-based natural resource management.  The project will also build skills in anti-poaching techniques and geographical information systems for wildlife managers.",,"-23.578952, 31.545715"
small_red,Africa,96200-1-G107,Isaac Seme and Wildlife Conservation Society,"Building capacity to reduce bushmeat consumption and trade in neighboring villages around the Bor Corridor, South Sudan","$10,000.00","$6,000.00",AFR-0137,South Sudan,"The purpose of this project is to build the capacity of ex-poachers to address the illegal bushmeat trade in three villages (Jalle, Pariak, and Padak) around the Bor migratory corridor in the Boma-Jonglei landscape in South Sudan.  It will make consumers and sellers aware of the bushmeat crisis in South Sudan, and train ex-poachers to participate in fish production as an alternative to reduce bushmeat hunting in the Bor Corridor.",,"5.550988, 32.529907"
small_red,Africa,96200-1-G108,Tanzania Wildlife Division,Capacity building to reduce illegal elephant hunting and bushmeat trade in the Selous Ecosystem in Tanzania,"$11,778.00","$115,760.00",AFR-0138,Tanzania,"This purpose of this project is to respond to illegal elephant hunting for bushmeat in and around the Selous ecosystem.  Activities will include holding meetings with village leaders and wildlife managers to discuss the status of the bushmeat trade, organizing workshops to train game wardens and village scouts to monitor elephants killed for bushmeat and to report elephant deaths, interviewing village residents involved in the bushmeat trade, and launching an awareness campaign in villages and schools about illegal bushmeat hunting and consumption.",,"-8.736999, 37.633514"
small_red,Africa,96200-1-G111,Endangered Wildlife Trust,The Pan-African Vulture Conservation Initiative,"$43,000.00","$8,000.00",AFR-0122,Regional-Africa,"The purpose of this project is to organize an African Vulture Summit to build a network of vulture specialists, researchers and fieldworkers across the continent who can work together to communicate, share information, build capacity, and transfer skills.  The initiative will promote conservation interventions to address the growing threats leading to declines in vulture populations.",This project covers the entire Africa continent.,","
small_red,Africa,96200-1-G122,Okello Genesis,"Alternative income generating activities for cultural chiefs and reformed poachers group in areas around Murchison Falls Conservation Area, Uganda","$10,000.00","$3,626.00",AFR-0135,Uganda,The purpose of this grant is to build upon ongoing efforts to engage cultural chiefs and the reformed poachers around the Murchison Falls Conservation Area in conservation.  It will build the capacity of leaders to aid in reducing bushmeat trade and consumption by addressing protein and economic alternatives together with bushmeat awareness and law enforcement efforts.,,"2.223563, 31.794434"
small_red,Africa,96200-1-G191,Sea to Shore Alliance,Conserving the West African Manatee (Trichechus senegalensis): Capacity Building for Long-Term Success,"$77,263.00","$74,682.00",AFR-0106,Regional-Africa,"The purpose of this project is to build a collaborative network of African researchers and resource managers who can work together to conserve West African manatees in every country in the species range (the African Atlantic coast from Mauritania to Angola, and the interior countries of Mali, Niger and Chad).  Activities include training in manatee fieldwork techniques and provision of needed field equipment in the network members’ countries.  Information on manatees will be disseminated to stakeholders to enable them to make informed decisions regarding the conservation of the West African manatee.","This is a very geographically broad project, expanding the entire habitat range for the manatee in West Africa. The coordinates provided is the central location to the project range.","9.646484, 8.061523"
small_red,Africa,96200-1-J001,Ecole de Faune de Garoua,Scholarships and technical capacity building at Garoua Ecole de Faune,"$110,000.00","$20,828.00",AFR-0139,Regional- West and Central Africa,"[NOTE: $10,000 additional funded by GACF, total award $120,000.] The purpose of this cooperative agreement is to provide three USFWS scholarships to West and Central African wildlife professionals who will benefit from contact with USFWS and partner organizations over the course of their careers.  It also builds the capacity of Ecole de Faune de Garoua faculty to more effectively teach and conduct applied research on great apes and wildlife conservation.",,"9.331226, 13.385658"
small_red,Africa,96200-1-G007,Zoological Society of London,Developing a program and building capacity for the conservation of the pygmy hippopotamus (Choeropsis liberiensis) across its range states,"$51,566.00","$63,404.00",AFR-0113,Liberia and Sierra Leone,"The purpose of this project is to strengthen the capacity of governments and national stakeholders in the pygmy hippopotamus range states of Liberia and Sierra Leone. It will train senior government wildlife authority staff, NGO personnel and university staff in strategic planning, field techniques and wildlife monitoring; help develop an IUCN Species Survival Commission-endorsed Pygmy Hippo Conservation Strategy; determine the current distribution of and threats to the pygmy hippo; and raise awareness about this evolutionarily distinct and endangered species.",,"5.472617, -8.4375"
small_purple,Amphibians in Decline,96200-1-G269,Smithsonian Institution,Probiotic method to reduce the threat of chytridiomycosis to Panamanian Golden Frogs II,"$29,000.00","$29,027.00",AD-0072,Panama,"This project will test the ability of anti-fungal bacteria to persist on Panamanian golden frog skin and confer resistance to the fungal pathogen, Batrachochytrium dendrobatidis (Bd), which is affecting golden frog populations. Skin swabs of Panamanian frogs will determine if these beneficial bacteria can colonize and persist on the skin of the species, and laboratory trials will treat the frogs to determine if anti-fungal bacteria improves survival of frogs exposed to Bd.",,"8.580015, -80.169952"
small_purple,Amphibians in Decline,96200-1-G270,Zoological Society of London,Building a future for the Chinese giant salamander: a consolidated approach to the conservation of Andrias davidianus,"$24,955.00","$109,272.00",AD-0074,China,"This project will build a long-term program for conservation of the Chinese giant salamander. The grantee will conduct field surveys and genetic analysis of giant salamander populations in Anhui, Guangxi, Shaanxi, and Qing’hai, including surveillance for emerging infectious diseases.  The project will also build capacity for networks of Chinese experts and stakeholders at key institutions, and train Chinese conservationists in field and laboratory protocols.",,"34.383742, 108.232422"
small_purple,Amphibians in Decline,96200-1-G271,Madagasikara Voakajy,Supporting communities to conserve the critically endangered golden mantella frog in Madagascar,"$24,925.00","$49,653.00",AD-0076,Madagascar,"This project will engage the government of Madagascar to support community-based organizations to conserve the golden mantella frog.  The project will restore and protect breeding ponds damaged by gold mining, train at least 5 community members to collect field data, and establish a community-based conservation organization in Lakato Village.  Community outreach will promote amphibian conservation and establish a traditional law to protect the breeding ponds.",,"-19.033271, 48.122559"
small_purple,Amphibians in Decline,96200-1-G272,San Francisco State University,Can we prevent a chytridiomycosis epidemic in the Philippines?,"$24,997.00","$20,023.00",AD-0084,Philippines,"This project will comprehensively survey for Batrachochytrium dendrobatidis (Bd) in the Phillippines and attempt to lower Bd infection intensity by treating frogs with beneficial bacteria.  The grantee will treat free-ranging amphibians with native mutually beneficial bacteria, and monitor the treatment’s success against the fungal pathogen responsible for chytridiomycosis.","This is a nation-wide project, the coordinates provided is the location of the initial outbreak.","14.239112, 120.654583"
small_purple,Amphibians in Decline,96200-1-G273,University of Basel,Conserving threatened amphibians of the Ethiopian highlands,"$30,650.00","$26,635.00",AD-0088,Ethiopia,"This project will develop management plans for at least four target amphibian species in the Ethiopian highlands, including revision of the species’ IUCN Red List assessments and public outreach.  The grantee will conduct disease surveillance and field surveys of species distribution and habitat, including less developed forest sites in Bale Mountain National Park and the Simien Mountains, and training for government wildlife authorities in amphibian conservation and field data collection.",,"6.648997, 39.247894"
small_purple,Amphibians in Decline,96200-1-G274,Denver Zoological Foundation,Conserving Peru's Lake Titacaca frog,"$23,390.00","$102,330.00",AD-0089,Peru,"This project will reduce harvest of the Lake Titicaca frog in Peru and increase awareness of the conservation status of the species.  The grantee will conduct field surveys to assess population trends, sampling for genetic analysis and fungal chytrid pathogen, and public outreach to promote amphibian conservation.  An amphibian breeding center will be established at the Universidad Nacional del Altiplano (UNA) at Puno.",,"-15.744382, -69.373474"
small_purple,Amphibians in Decline,96200-1-G275,Wildlife Information Liaison Development Society-Zoo Outreach Organization,"Evaluation and impact of chytridiomycosis on the endemic, highly threatened amphibians of
the Western Ghats","$24,640.00","$43,010.00",AD-0090,India,"This project will sample for the presence of the fungal pathogen, Batrachochytrium dendrobatidis (Bd) in the threatened amphibians of the Western Ghats, India.  The grantee will conduct a field survey of the status of Bd in at least 10 locations, develop a policy document that addresses exotic species in the aquarium trade, and coordinate public outreach to promote amphibian conservation.",The coordinates provided is the location of one out of at least 10 study locations across western India. This location is centurally located in the project's study area.,"15.201742, 74.638672"
small_purple,Amphibians in Decline,96200-1-G276,CapeNature,Rough moss frog habitat protection project,"$42,307.00","$36,756.50",AD-0098,South Africa,"This project will restore at least 1,350 hectares of habitat for the rough moss frog in southern South Africa by controlling an invasive pine tree that increases the risk of catastrophic fire. The grantee will also conduct at least 6 field surveys of rough moss frog abundance.",,"-34.191058, 19.49213"
small_purple,Amphibians in Decline,96200-1-G277,Fundacion Ontaga,"Emergency action for the conservation of Hyloxalus jacobuspetersi (Amphibia: Dendrobatidae), a species at the verge of extinction","$24,999.00","$4,550.00",AD-0103,Ecuador,"This project will establish a captive assurance colony for a species of poison arrow dart frog, Hyloxalus jacobuspetersi, in central Ecuador.  The grantee will conduct field surveys and behavioral studies of wild individuals in the Valle de los Chillos, including disease surveillance to determine frequency of infection and chytrid’s impact on the survival of target species.  The grantee will also protect and restore habitat for the species, including re-routing of a visitor path.",,"-0.636889, -79.005737"
small_purple,Amphibians in Decline,96200-1-G278,University of South Dakota,Identifying antifungal cutaneous bacteria for potential biocontrol of the amphibian chytrid fungus in Costa Rica,"$34,997.00","$12,947.00",AD-0107,Costa Rica,"This grant will support the costs of culturing bacteria from amphibian populations that have survived chytridiomycosis epidemics to search for microbes that may increase resistance to the disease.  The grantee will grow different types of bacteria found on at least 20 wild frogs from 10 populations in Costa Rica, and conduct trials to identify the bacteria species that inhibits the fungal pathogen responsible for chytridiomycosis.",The coordinates provided is the location of one out of 10 study locations across Costa Rica. This location is centrually located in the project's study area,"9.368074, -83.183289"
small_purple,Amphibians in Decline,96200-1-G279,Drexel University,"Conservation of Bioko Island's endangered amphibians, Arlequins krebis and Didynamipus sjostedti","$10,609.00","$11,681.00",AD-0113,Equatorial Guinea,"This project will prevent immediate destruction of critical habitat for two endangered frogs on Bioko Island, Equatorial Guinea.  The grantee will conduct a habitat assessment and coordinate with a road construction company, Razel Inc., to mitigate the effects of a new road.  The grantee will also promote amphibian conservation to local authorities.",,"3.343443, 8.656664"
small_purple,Amphibians in Decline,96200-1-G280,The Natural History Museum,Conservation of Cameroon's caecilian amphibians,"$24,955.00","$25,432.00",AD-0116,Cameroon,"This project will support five species of poorly known caecilians in Cameroon by building national capacity in caecilian natural history and conservation.  The grantee will conduct field surveys in forested areas, reassessments of the species’ conservation status, and training for Cameroonian personnel in caecilian biology and conservation.",The coordinates provided is one of several survey locations throughout Cameroon.,"6.106494, 9.321823"
small_purple,Amphibians in Decline,96200-1-G291,National Museums of Kenya,"Habitat restoration for the critically endangered Sagalla caecilian Boulengerula niedeni Muller, Measey, Loader & Malonza, 2005 in Sagalla Hill, Kenya","$22,917.00","$11,995.00",AD-0070,Kenya,"This project will address the direct threats affecting the Sagalla caecilian including soil erosion, water draining, and siphoning effects of exotic plant species. The grant will support hiring and supervising of community participants to identify and plant the most viable native tree species for each location.  The grantee will develop educational materials on procedures for tendering and maintenance of native plant species.",,"-3.482389, 38.569546"
measle_brown,Grate Ape,96200-1-G232,Wildlife Conservation Society,"Continued conservation and monitoring of the yellow-cheeked crested gibbon (Nomascus gabriellae) in Southern Mondulkiri, Cambodia","$59,386.00","$59,303.00",GA-0784,Cambodia,"This grant will support continuing efforts to maintain gibbon populations at their 2008 levels in the core area of  Seima Protection Forest.   The project will protect gibbons and their habitat, assessing the effectiveness of conservation management through the monitoring of gibbons and other target species, and improve the capacity of Cambodian scientists to analyze the results of 7 years of gibbon conservation.",,"12.431063, 106.825562"
measle_brown,Grate Ape,96200-1-G235,Wildlife Conservation Society,Northern Plains of Cambodia Pileated Gibbon Conservation Project: Phase 3,"$57,244.00","$61,351.00",GA-0847 Asia,Cambodia,"This grant will support basic equipment, monitoring and targeted patrols to ensure that the pileated gibbon is protected in its most important habitats of this landscape.  The grantee will retrain staff in law enforcement techniques and MIST data collection, ensuring effective protection through targeted patrol planning and improved government relations.",,"14.089887, 105.485229"
measle_brown,Grate Ape,96200-1-G010,Zoological Society of San Diego,"Long-term research and conservation of gorillas and chimpanzees in the Ebo Forest, Cameroon","$138,162.00","$248,882.00",GA-0701,Cameroon,"This two-year project will assist the government of Cameroon in the gazettement and demarcation of the proposed Ebo National Park. The grantee will monitor wildlife, support law enforcement activities undertaken by the Ministry of Forestry and Wildlife to conserve key populations of gorillas and chimpanzees, and continue to deploy camera traps throughout the forest to document chimpanzee behavior and record hunter presence in the reserve.",,"4.3389, 10.4519"
measle_brown,Grate Ape,96200-1-G178,North Carolina Zoological Society,Use of trained detection dogs to non-invasively collect fecal samples from the Critically Endangered Cross River gorilla (Gorilla gorilla diehli) in Cameroon,"$46,870.00","$46,900.00",GA-0807 Africa,Cameroon,This project will improve the evaluation capacity of Cross River gorilla conservation efforts by exploring the feasibility of using detection dogs both for fecal collection and to identify illegal bushmeat at Douala international airport.,,"6.135, 9.7664"
measle_brown,Grate Ape,96200-1-G184,Zoological Society of London,Wildlife Wood Project: ensuring responsible wildlife management in timber production forests in Cameroon,"$51,968.00","$71,060.00",GA-0852 Africa,Cameroon,"This project will ensure responsible wildlife management in the timber production forests of Central Africa for the benefit of local populations, national governments, and the logging sector.",,"3.247, 14.306"
